{
  "$schema": "../../schema/role-manifest.schema.json",
  "role": "qa",
  "extends": "_base",
  "name": "FuzeInfra qa (test-engineer)",
  "description": "INDEPENDENT acceptance / contract / integration tests against the spec — the honest grader. QA reuses the test-engineer persona.",
  "persona": ".claude/agents/test-engineer.md",
  "environment": "cloud-qa",
  "system_append": "ENVIRONMENT: cloud sandbox with pytest + Playwright. You reach applications under test over their public/tunnel URLs only (read-only); you have NO cluster write credentials. NEVER kubectl patch/edit a live resource to make a test pass — a failing acceptance test is your correct output, reported to backend/devops. GitHub write is via the github MCP tool.",
  "services": { "github": "write", "k8s": "read", "cloud": "none" },
  "metadata": { "role": "qa" }
}
